index,start,end,text
575,3050.64,3056.64,"не хотите, чтобы ваши сотрудники заходили все рамку с домочных компьютеров, допустим."
576,3056.64,3060.64,"То есть, они будут заходить только с офисного эпичника и все."
577,3060.64,3068.64,"Прохси, это я не знаю, если честно, это что-то ребята добавили в этот."
578,3068.64,3074.64,"Это скорее всего, прохси IP already exist, это скорее всего при автологине."
579,3074.64,3077.64,"Но это надо еще поспрашивать, потому что это тестовая ветка."
580,3077.64,3082.64,И в тестовая тут ребята могут добавлять все шугу.
581,3083.64,3084.64,Вот.
582,3084.64,3087.64,Интеграция есть у нас с гитару.
583,3087.64,3090.64,Можем постбеки настраивать Cloudflare.
584,3090.64,3093.64,"Понятно, что я говорил, что закупка Namecheap,"
585,3093.64,3096.64,"Facebook, можем передавать конверсии."
586,3096.64,3097.64,"А, кстати, прикольная штука."
587,3097.64,3102.64,"Мы можем отбивать, вы можете пиксель ставить,"
588,3102.64,3106.64,"как типа, аля, на странице спасибо, как вы default-ном делают."
589,3107.64,3114.64,"Так, и мы можем, не помню, как это называется, именно Facebook,"
590,3114.64,3122.64,"в принципе, это онлайн-конверсия, а Facebook, типа, конверсия, типа действия какой-то,"
591,3122.64,3129.64,которые мы можем призначит поставить еще разную ценность.
592,3129.64,3133.64,"То есть, мы можем отбивать, допустим, пиксель,"
593,3133.64,3138.64,"только в том случае, если Duda звонились, то есть конверсию отбивать."
594,3138.64,3142.64,Таким образом более интересно.
595,3142.64,3146.64,"Ну это за событие, по-моему, что мы настраиваем."
596,3146.64,3148.64,Еще раз.
597,3148.64,3153.64,Но это уже событие должны там не только на вашей стороне настраивать.
598,3153.64,3154.64,"Да, событие."
599,3154.64,3155.64,Да-да-да.
600,3155.64,3156.64,Вот.
601,3156.64,3160.64,"HitLab это для того, чтобы хостить Ланды,"
602,3160.64,3165.64,"то есть, как выстроена структура именно с серверами."
603,3165.64,3175.64,"У нас все серверами и сландами, у нас все Ланды изначально не хостятся сразу на сервер,"
604,3175.64,3177.64,они хостятся в HitLab.
605,3177.64,3181.64,"Вот, и когда вы уже создаете ссылку, они уже хостятся на сервере."
606,3181.64,3187.64,"Это нам позволяет, во-первых, не политься, как гитара биномы перед Google-ом,"
607,3187.64,3192.64,"а во-вторых, нам позволяет потом быстро, в случае банн сервера,"
608,3192.64,3195.64,очень быстро перенести это на другой сервер.
609,3195.64,3198.64,Мы можем это сделать даже автоматически.
610,3198.64,3203.64,"То есть, если у вас сервер один забанился, сразу все Ланды, все домини переносятся на другой."
611,3203.64,3206.64,"Но я бы так и не рекомендовала, потому что, допустим,"
612,3206.64,3210.64,"мы, скорее всего, сервера будете покупать на одном и том же провайдере,"
613,3210.64,3215.64,"то есть, хотя бы даже с разных аккаунтов, и сервера банятся за домин."
614,3215.64,3220.64,"Если автоматически настроить, то домин автоматически привяжется на другой сервер,"
615,3220.64,3226.64,"провайдер это может спалить, и вот так по цепочке все резервные сервера забанить."
616,3226.64,3231.64,"Переносить там очень легко, ну, короче, там не сложно."
617,3231.64,3236.64,"Динодот это тоже покупать домины можно, удобно за крипту."
618,3236.64,3241.64,"Хоть клик к Владиум, ребята, понятно, что такое."
619,3241.64,3245.64,"Что еще, что еще можно сказать?"
620,3245.64,3250.64,Можем подменять название воронок.
621,3250.64,3255.64,"Можем, допустим, Тесла."
622,3258.64,3260.64,Тесла.
623,3260.64,3266.64,"И, допустим, вам от Левы, Брокера запрувили воронку Тесла, которая выглядит как Ланд."
624,3266.64,3271.64,"Давайте еще там Тесла Квиз, Тесла Литформа,"
625,3271.64,3276.64,"и вы хотите, чтобы у вас все ранки все-таки статистика была по каждой из воронок."
626,3276.64,3281.64,"Не подписывать, не все передавать как Тесла, чтобы это все потом невозможно было проанализировать,"
627,3281.64,3284.64,"а вы подписываете себя, как хотите."
628,3284.64,3289.64,"Брокеру вы хотите передавать просто Тесла, и у нее все воронки, допустим, это у нас Тесла,"
629,3289.64,3292.64,"это у нас Тесла Квиз, а та Тесла Литформа."
630,3292.64,3297.64,"И теперь Брокеру будут вот эти все три воронки, будут передаваться как Тесла."
631,3297.64,3302.64,"Вот, это можно настроить глобально на все компании вот тут,"
632,3302.64,3307.64,"либо отдельно, мы можем это настроить на отдельно взятый компайн,"
633,3307.64,3311.64,"именно на этот компайн мы будем передавать, допустим, вот так, то есть это у фаналсии,"
634,3311.64,3316.64,"мы уже вот тут берем и выбираем, либо вот поставить галочку и абсолютно все воротки,"
635,3316.64,3321.64,"которые будут сюда заходить, будут передаваться там Тесла Ланд, допустим."
636,3322.64,3329.64,"Вот, можно, а, есть прикольная штука, недавно сделали, это отложенные действия по изменениям."
637,3329.64,3336.64,"Обычно как настраиваются компей, как настраиваются капы,"
638,3336.64,3345.64,"дожидаются пролив на следующий, сегодняшний, то есть до 19.00 отливается трафик."
639,3345.64,3351.64,"После 19.00 все садятся и начинают настраивать, какой трафик будете идти завтра,"
640,3351.64,3355.64,"какая дневная капа, какие воронки, выставляется это все,"
641,3355.64,3360.64,"потому что если вы настроите это во время пролива, есть шанс залить что-то не то,"
642,3360.64,3362.64,потому что вы измените уже сейчас.
643,3362.64,3367.64,"Мы сделали отложенные действия, мы можем выбрать,"
644,3368.64,3373.64,"в дата время выбираем, какие воронки будут,"
645,3373.64,3377.64,"то еще, кстати, не добавили, это добавится еще,"
646,3377.64,3383.64,"это пока что наши партнеры-тесты, которые прям это попросили,"
647,3383.64,3387.64,"тут еще будет дневная капа и вес,"
648,3387.64,3391.64,"и будет отдельно капа по юзерам, по сорсам,"
649,3391.64,3394.64,"то есть мы можем отдельно выстроить капу,"
650,3394.64,3400.64,"допустим, у нас общая капа 50, и мы можем, например, на сорс в Google выставить капу 20,"
651,3400.64,3404.64,"а на сорс там в ФБ, капу 30, вот,"
652,3404.64,3411.64,"и равномерно размешивать трафик, то есть это тут тоже будет."
653,3414.64,3420.64,"Пока что это еще, скорее всего, ну, я думаю, через месяц где-то всем обновим,"
654,3420.64,3424.64,"вот, сейчас просто ребята там тестировали, сначала вот это сделали,"
655,3424.64,3428.64,"они сказали, что нам еще надо, типа, вот, ну, то, что я рассказал, добавить."
656,3428.64,3435.64,"Вот, если у вас есть какие-то запросы, потому что нужно добавить,"
657,3435.64,3439.64,"и это действительно мы увидим, что это нужно не только вам, а всем,"
658,3439.64,3441.64,то есть мы это без проблем добавляем.
659,3441.64,3443.64,"Раньше мы это довольно быстро добавляли,"
660,3443.64,3447.64,"сейчас задачи в целом пошли более сложные от всех,"
661,3447.64,3450.64,"и, типа, и нас в плане тоже, типа, то, что мы хотим доделать,"
662,3450.64,3453.64,"поэтому сейчас немножко у нас заблевления затягиваются,"
663,3453.64,3455.64,"то есть мы хотим на нема новых программистов,"
664,3455.64,3461.64,"но все равно все сложнее и сложнее становится, что-то новой добавляем."
665,3461.64,3463.64,"Слушайте, пожалуйста, а может быть у вас,"
666,3463.64,3466.64,"может быть у вас где-то еще будет секица ваш roadmap,"
667,3466.64,3471.64,"ну, то есть если мы будем сами работать, чтобы вы понимали, какие функции,"
668,3471.64,3473.64,"когда примерно, ожидать, то есть, в принципе, вот,"
669,3473.64,3479.64,"roadmap, скорее всего, нет, у нас все-таки небольшая компания,"
670,3479.64,3484.64,"мы больше как вот стартап, там, вот, в таком формате,"
671,3484.64,3486.64,то есть у нас все...
672,3486.64,3489.64,"Что за поединок, что-то не сделано?"
673,3489.64,3493.64,"У нас все получается как-то вот само по себе,"
674,3493.64,3495.64,"в том, что мы там добавляем какие-то функции,"
675,3495.64,3499.64,"просто там кому-то надо срочно, вот, кто-то хочет купить ранку,"
676,3499.64,3502.64,"им не хватает какой-то функции, им надо срочно называть какую-то функцию."
677,3502.64,3506.64,"Мы берем, там, временно выделяем на так какие-то ресурсы,"
678,3506.64,3508.64,"чтобы это быстро никогда не добавить, делаем."
679,3508.64,3511.64,"У кого-то что-то там сломалось, такое тоже бывает,"
680,3511.64,3516.64,"тоже это, в очередной задаче, там, быстро пофиксить, что-то еще."
681,3516.64,3521.64,"Вот, ванна, развить трекер в дальнейшем,"
682,3521.64,3523.64,"чтобы это был прям полноценный трекер,"
683,3523.64,3526.64,"чтобы не стыдно было говорить, что вот, не,"
684,3526.64,3529.64,"берите, переходите на наш, зачем вам перекладывать,"
685,3529.64,3532.64,"а что за китара, вот, то есть, у нас, видите, какая,"
686,3532.64,3537.64,"мы функции все, у нас нету никаких доп-платежей, еще чего-то,"
687,3537.64,3541.64,"мы сразу даем весь функционал, берите, пользуйтесь,"
688,3541.64,3547.64,"то есть, у нас и под банх, и под нетворк, все сразу доступно."
689,3547.64,3549.64,"Вот, то же самое, скорее всего, будет там,"
690,3549.64,3552.64,"и с трекерами, и с этого, может, возможно, там трекер будет,"
691,3552.64,3554.64,"как еще отдельный продукт, но для пользователей си-ранки,"
692,3554.64,3557.64,оно будет доступно всем сразу.
693,3557.64,3562.64,"Вот, прям roadmap, сложно сказать, вот, поэтому,"
694,3562.64,3568.64,"мы иногда забываем описать, какие функции мы добавили всем, вот,"
695,3568.64,3572.64,"а тут еще roadmap добавлять, ну, если..."
696,3572.64,3575.64,"Да, вот вопрос, получается, касательно релизноутсов,"
697,3575.64,3578.64,"то есть, у вас выходят на наобновление,"
698,3578.64,3581.64,"тут, кстати, вопрос, у вас какая-то,"
699,3582.64,3585.64,"ну, существует ли какой-то календарик выпускорелизов, вот,"
700,3585.64,3589.64,"и далее с выпуском релиза, и так понимают,"
701,3589.64,3591.64,"до либо после нас, как то вы домляете,"
702,3591.64,3593.64,"да, тому, что изменилось, возможно,"
703,3593.64,3595.64,"какие-то данные, микрация есть, а другого..."
704,3595.64,3599.64,"Мы пишем вам, смотрите, у нас даже, у нас немножко все"
705,3599.64,3602.64,"в этом плане, сложновато еще сделано,"
706,3602.64,3607.64,"потому что мы обновляем всех неравномерно, вот,"
707,3607.64,3610.64,"то есть, у нас есть партнеры, допустим,"
708,3610.64,3612.64,"которые, типа, ну, с ними там уже,"
709,3612.64,3615.64,"в плотно работаем дружим, либо кто-то что-то попросил,"
710,3615.64,3618.64,"и мы, допустим, накатываем, если они,"
711,3618.64,3621.64,"допустим, что-то попросили, мы накатим вам версию последнюю,"
712,3621.64,3625.64,"плюс то, что вы попросили, вот,"
713,3625.64,3628.64,"потом, какое-то время, вы вам накатывать ничего не будем,"
714,3628.64,3631.64,"вот, другим накатим, другим, у ваша версия,"
715,3631.64,3633.64,"типа, если вы уже с вами там, вы бы катали,"
716,3633.64,3635.64,"багов каких-то не поймали,"
717,3635.64,3638.64,"то есть, ну, это функция, которую вы попросили,"
718,3638.64,3641.28,"мы потом берем и, типа, их добавляем"
719,3641.28,3643.64,"уже в общую какую-то версию,"
720,3643.64,3644.76,"州, которой, типа, там,"
721,3644.76,3646.88,"в следующий раз, если кому-то будем обновлять,"
722,3646.88,3649.64,"мы уже ее обновим, и, так, таким образом,"
723,3649.64,3658.84,мы постепенно постр Money Chain doesn't play out
724,3658.84,3660.64,"так далее, если взять какой-то баг появится,"
725,3660.64,3662.82,"то он появится сразу у всех, типа,"
726,3662.82,3664.64,"таким образом, типа, мы постепенно,"
727,3664.64,3666.14,"постепенно обновляем,"
728,3666.14,3670.14,"Если у нас собирается какая-то уже критическая масса обновлений,"
729,3670.54,3672.98,"мы смотрим, что у вас давно не было обновлений,"
730,3673.38,3675.94,"мы вас берем обновляем, вывокатываем вам текст,"
731,3675.94,3678.86,потому какие функции вам сейчас добавились.
732,3679.54,3681.78,"Типа, в таком формате мы работаем."
733,3682.38,3686.22,"Структурировать это, чтобы обновлялось,"
734,3686.22,3690.34,"ну, мы стараемся все-таки более быстро какие-то функции медрять,"
735,3690.34,3694.06,"если это все прям будем расписывать, вытащивать и так дальше,"
736,3694.46,3696.18,скорость вот эта вся потеряется.
737,3699.46,3700.58,"Да, принято хорошо."
738,3700.58,3703.34,"Ну, в принципе, это интересная вопрос, какого размеров у вас команда."
739,3703.66,3705.54,"Вот так просто, вроде интереса есть."
740,3705.54,3710.3,"Давайте посчитаем три ковнера,"
741,3712.54,3713.94,"четыре программиста,"
742,3715.7,3716.38,"суппорт,"
743,3717.38,3718.14,"вот,"
744,3718.82,3720.14,"суппорт-интерраторы там,"
745,3722.14,3723.74,"нет, три программиста,"
746,3723.74,3725.78,"суппорт, который иногда еще и кодит,"
747,3725.78,3727.34,"и еще у нас,"
748,3727.34,3729.5,"вернее, интерратор, который еще и кодит,"
749,3729.5,3731.54,и суппорт получается
750,3733.54,3734.62,"три, три,"
751,3736.9,3739.18,"Господи, как же я давно не считал в уме."
752,3740.78,3741.74,"Ну, вот он и кодит."
753,3741.74,3742.98,"Так, короче,"
754,3742.98,3744.14,"хорошо, спасибо."
755,3744.14,3745.9,"Хорошо, хорошо, спасибо большое."
756,3746.86,3747.58,"Да, ну,"
757,3747.58,3749.06,"да, у меня вопрос."
758,3749.06,3750.66,А сколько времени
759,3750.66,3752.42,принимает реализация
760,3752.42,3753.7,какой-то фичи?
761,3754.62,3755.5,"Поразно,"
762,3755.5,3757.18,зависим от
763,3758.02,3759.06,"фичка, ну,"
764,3759.06,3760.18,"в зависимости от сложности,"
765,3760.18,3761.7,"в зависимости от загруженности,"
766,3761.7,3762.62,очень сложно сказать.
767,3762.62,3764.3,"Ну, типа, в течение месяца"
768,3764.3,3765.1,"что-то добавить,"
769,3765.1,3766.34,"это не прям большая проблема,"
770,3766.34,3767.34,"если сильно нужно,"
771,3767.86,3769.98,"если прям не сильно оно нужно,"
772,3770.42,3771.38,"вот, то мы скажем,"
773,3771.38,3772.9,"что это прям не сильно нужно,"
774,3772.9,3774.66,"мы сделаем там попозже,"
775,3774.74,3775.86,"и это уже может там,"
776,3775.86,3776.78,"там, через месяц,"
777,3776.78,3778.06,будет там или через два.
778,3778.66,3780.34,"Вот, если прям не сильно"
779,3780.34,3781.78,"в этом видим какой-то приоритет,"
780,3781.78,3783.14,"потому что, ну, иногда просят,"
781,3784.14,3784.74,"ну,"
782,3785.54,3787.06,что-то там поменять
783,3787.7,3788.74,"какую-то иконку,"
784,3788.74,3789.62,"или что-то еще,"
785,3789.62,3791.3,"потому что не красиво смотрится,"
786,3791.3,3792.38,"ну, мы"
787,3792.9,3794.5,"не за красотой сюда пришли,"
788,3794.5,3795.58,мы все-таки стараемся
789,3795.58,3797.22,"сделать функциональный продукт,"
790,3797.9,3798.9,"вот, то,"
791,3798.9,3800.98,"ну, такие фишки там много будут."
792,3802.02,3802.54,Вот.
793,3805.1,3805.66,Вот.
794,3805.66,3806.94,Еще какие-то вопросы есть?
795,3811.94,3812.94,"Да, у меня"
796,3813.66,3815.46,"нет, не осталось вопросов."
797,3815.46,3817.14,"Ага, спасибо большое,"
798,3817.14,3818.14,"очень познавательно,"
799,3818.14,3819.26,интересно было послушать.
800,3820.26,3822.26,"Да, не за что я вам спасибо."
801,3822.26,3823.46,"По прайсам,"
802,3823.46,3824.46,700 долларов в месяц.
803,3825.98,3826.98,"Это вот,"
804,3826.98,3827.98,"это вот,"
805,3827.98,3828.98,"это вот,"
806,3828.98,3829.98,"это вот,"
807,3829.98,3830.98,"это вот,"
808,3830.98,3831.98,"это вот,"
809,3831.98,3832.98,"это вот,"
810,3832.98,3833.98,"это вот,"
811,3833.98,3834.98,"это вот,"
812,3834.98,3835.98,"один тариф,"
813,3835.98,3836.98,"фиксированный и сюда,"
814,3836.98,3838.98,"сюда входит и поддержка,"
815,3838.98,3839.98,"и,"
816,3839.98,3840.98,"ну, сама сиренка получается."
817,3840.98,3841.98,Да.
818,3842.98,3843.98,Угу.
819,3843.98,3844.98,"Все,"
820,3844.98,3845.98,супер.
821,3846.98,3847.98,"У нас время до,"
822,3847.98,3848.98,"получается,"
823,3848.98,3849.98,понедельника
824,3849.98,3850.98,следующего.
825,3850.98,3852.98,Еще у нас запланированы
826,3852.98,3854.98,"созвоны, поэтому мы будем"
827,3855.98,3856.98,"держать вас в курсе,"
828,3856.98,3857.98,"тогда,"
829,3857.98,3858.98,"как уже по результатам,"
830,3859.98,3860.98,будем принимать решение.
831,3860.98,3861.98,Хорошо.
832,3861.98,3862.98,Будем ждать.
833,3863.98,3864.98,Спасибо большое
834,3864.98,3865.98,"для презентацию,"
835,3865.98,3866.98,"да, очень познавательно,"
836,3866.98,3867.98,полезно.
837,3867.98,3868.98,Угу.
838,3868.98,3869.98,И вам спасибо.
839,3869.98,3870.98,"Все,"
840,3870.98,3871.98,у хорошего дня.
841,3871.98,3872.98,"Ух, хорошо."
842,3872.98,3873.98,До свидания.
843,3873.98,3874.98,До свидания.
844,3874.98,3875.98,До свидания.
